{
  "feedback_id": "receipt-1733452900000-det-001",
  "decision_receipt_id": "receipt-1733452800000-det-000",
  "pattern_id": "FB-01",
  "choice": "worked",
  "tags": ["accurate", "helpful", "timely"],
  "actor": {
    "repo_id": "detection-engine-core",
    "machine_fingerprint": "fp-det001"
  },
  "timestamp_utc": "2025-01-01T00:00:00Z",
  "signature": "sig-det-1a2b3c4d5e6f7a8b9c0d1e2f3a4b5c6d7e8f9a0b1c2d3e4f5a6b7c8d9e0f1"
}
