{
  "feedback_id": "receipt-1733452900000-i9j8k7l6m5n4o3p2",
  "decision_receipt_id": "receipt-1733452800000-a1b2c3d4e5f6g7h8",
  "pattern_id": "FB-01",
  "choice": "worked",
  "tags": ["accurate", "helpful", "timely"],
  "actor": {
    "repo_id": "analytics-and-reporting",
    "machine_fingerprint": "fp-abc123def456"
  },
  "timestamp_utc": "2025-11-05T12:01:40.000Z",
  "signature": "sig-1a2b3c4d5e6f7a8b9c0d1e2f3a4b5c6d7e8f9a0b1c2d3e4f5a6b7c8d9e0f1a2b3"
}
